author,school,year_written,title,type,text,score,score_out_of_100,grading_basic,score_basic_model,explanation_basic_model,loss_basic_model,grading_gemini,score_gemini,explanation_gemini,loss_gemini,grading_llama,score_llama,explanation_llama,loss_llama
Stephanie Heng,Raffles Institution,2019,Technology has alienated people instead of bringing them together. Discuss.,llama,"Technology has alienated people instead of bringing them together, or has it? With the rise of technology, people has become more isolated then ever before. They spend most of their time staring at screens, tapping away on their phones, and neglecting the people around them. This trend has only escalated with the advent of social media, where people can curate a perfect online persona, and hide behind a mask of superficiality.

Some people argue that technology has made it easier for people to connect with each other, but I believe that this is just a myth. For instance, in Japan, there exist groups of individuals, labelled as 'otakus', who devote their entire lives to the digital world and therefore experience extreme fear, anxiety, or detachment when forced to interact within the real world. This shows that technology is actually detrimental towards the construction of lasting and meaningful human relationships, by damaging the individual's ability to connect with others socially.

However, some people would disagree with me, they would say that technology has improved the way we communicate with each other. For example, video conferencing allows people to connect with others from all over the world, and social media allows us to keep in touch with our friends and family who are far away. But I think this is just a superficial way of connecting with others, it's not a real connection.

Moreover, technology has also made us more lazy, we don't even bother to get out of our houses to meet our friends, we just send them a text or a snapchat. We don't even bother to learn about what's going on in the world, we just scroll through our social media feeds and think we're informed. This is not a healthy way of living, and it's all because of technology.

In conclusion, technology has definitely alienated people, it has made us more isolated, more lazy, and more superficial. We need to be careful about how we use technology, and make sure it's not controlling our lives.",32,64.0,"Score: 58/100
Explanation: The essay demonstrates a basic understanding of the topic, presenting arguments for and against the idea that technology alienates people. However, the analysis lacks depth and critical evaluation. The writing is clear but contains grammatical errors and limited vocabulary. The structure is simple, with an introduction, body paragraphs, and conclusion, but the flow of ideas could be improved. The ""otaku"" example is relevant but could be explored in more detail.
",58.0,"The essay demonstrates a basic understanding of the topic, presenting arguments for and against the idea that technology alienates people. However, the analysis lacks depth and critical evaluation. The writing is clear but contains grammatical errors and limited vocabulary. The structure is simple, with an introduction, body paragraphs, and conclusion, but the flow of ideas could be improved. The ""otaku"" example is relevant but could be explored in more detail.",6.0,"Score: 55/100
Explanation: The essay demonstrates a basic understanding of the topic but lacks depth in analysis and evaluation. The arguments are somewhat simplistic and rely heavily on generalizations. While the structure is present, the flow of ideas could be improved. The clarity of communication is adequate, but the range of vocabulary and accuracy of language could be enhanced. The essay does not fully explore the complexities of the issue and presents a somewhat one-sided perspective.
",55.0,"The essay demonstrates a basic understanding of the topic but lacks depth in analysis and evaluation. The arguments are somewhat simplistic and rely heavily on generalizations. While the structure is present, the flow of ideas could be improved. The clarity of communication is adequate, but the range of vocabulary and accuracy of language could be enhanced. The essay does not fully explore the complexities of the issue and presents a somewhat one-sided perspective.",9.0,"score: 72
essay_id: technology has alienated people instead of bringing them together. discuss.
explanation: this essay demonstrates a good understanding of the topic and presents some relevant arguments. the writer provides examples, such as the 'otakus' in japan, to support their claim that technology has alienated people. however, the essay lacks depth and nuance in its analysis, and the writer's opinions are not always well-supported. the structure and organization of the essay are clear, but the writer could have explored more perspectives and counterarguments to strengthen their position. additionally, the language and vocabulary used are not particularly sophisticated, which affects the overall clarity and communication of the essay.",72.0,"this essay demonstrates a good understanding of the topic and presents some relevant arguments. the writer provides examples, such as the 'otakus' in japan, to support their claim that technology has alienated people. however, the essay lacks depth and nuance in its analysis, and the writer's opinions are not always well-supported. the structure and organization of the essay are clear, but the writer could have explored more perspectives and counterarguments to strengthen their position. additionally, the language and vocabulary used are not particularly sophisticated, which affects the overall clarity and communication of the essay.",8.0
Chirin Soh,Raffles Institution,2019,To what extent is education still the key to a nation’s success.,llama,"To what extent is education still the key to a nation's success?

Education has always been viewed as the key to eliminating gender inequality, reducing poverty, creating a sustainable planet, preventing deaths and illness, and fostering peace. As Nelson Mandela once said, ""Education is the most powerful weapon which you can use to change the world."" It equips individuals with knowledge and skills to be self-sustaining and independent. However, the structure of formal education has failed to keep up with the rapid changes in technology and advancements in society. This has led some to question whether education is still a crucial component for a country to thrive.

Detractors may argue that the outdated education system in most countries are ineffective in equipping individuals with the right skills for success. The current education system was designed for the industrial era. Schools have a top-down culture, with a one-size-fits-all curriculum. Cohorts are age-based and students are streamed based on standardised test. The issue with this system is that students are trained to drill context, memorisation and regurgitation of large chunks of information. This can be seen through the extensive syllabus requirements for Cambridge A-levels, as well as lengthy vocabulary lists that students memorise in preparation for SATs.

In this digital age, content is less important than context. With an Internet connection, there is a wealth of information right at our fingertips, one click away. It is more important to be able to respond to real life challenges through problem solving skills, analytical skills and inference skills. Little focus is placed on developing these skills and people are left to learn them through their experiences later in life, if they even pick them up.

However, I believe education is still the key as it imparts important values for social cohesion, inculcates relevant skills for economic progress and empowers people to make positive social change. Many changes are underway to fix the flaws in the education so that it continues to provide a quality education for all and bring success to the nation. Governments in many developed countries have acknowledged the inequality problem and are actively finding solutions.

Finland provides a prime example of a revolutionised, modernised education system. They have no standardised tests and a more relaxed atmosphere. Formal education is only compulsory at the age of 9 and class sizes are small. Students have the free time to pursue their own independent learning and pursue their other passions. Teachers also know their students well and can provide them with more support.

Education is also all the more necessary for society to remain harmonious. Globalisation has brought about diversity since people from all over the world are able to meet, whether in real life or virtually. Being global-minded and having collaboration skills are of great importance as they determine the country's success. Fostering of a more united community is done through community education where students are taught about different groups of people and learn to be accepting of those different from them.

In conclusion, as HG Wells puts it, ""Human history becomes more and more a race between education and catastrophe."" Although there may be some flaws in education systems today, it is still imperative that nations be rid of the greatest enemy of progress- ignorance. Education is a big investment that countries are willing to make due to its continued importance in bringing success to a nation through promoting social cohesion, developing the economy and combating social issues.",35,70.0,"Score: 78/100
Explanation: The essay demonstrates a good understanding of the topic and presents a balanced argument. It acknowledges the limitations of current education systems while arguing for its continued importance. The Finland example is relevant and supports the argument. The essay is well-structured and clearly written. However, the analysis could be deeper, and more specific examples could strengthen the points made. The language is generally accurate, but there's room for more sophisticated vocabulary.
",78.0,"The essay demonstrates a good understanding of the topic and presents a balanced argument. It acknowledges the limitations of current education systems while arguing for its continued importance. The Finland example is relevant and supports the argument. The essay is well-structured and clearly written. However, the analysis could be deeper, and more specific examples could strengthen the points made. The language is generally accurate, but there's room for more sophisticated vocabulary.",8.0,"Score: 65/100
Explanation: The essay demonstrates a basic understanding of the topic and presents some relevant arguments. However, the analysis lacks depth and critical evaluation. The structure is somewhat disjointed, and the essay relies heavily on assertions without sufficient supporting evidence or detailed examples. While the writing is generally clear, the vocabulary and register are not consistently sophisticated.
",65.0,"The essay demonstrates a basic understanding of the topic and presents some relevant arguments. However, the analysis lacks depth and critical evaluation. The structure is somewhat disjointed, and the essay relies heavily on assertions without sufficient supporting evidence or detailed examples. While the writing is generally clear, the vocabulary and register are not consistently sophisticated.",5.0,"score: 92
essay_id: to what extent is education still the key to a nation's success.
explanation: this essay demonstrates a deep understanding of the topic, presenting a clear and well-supported argument that education is still crucial for a nation's success. the writer effectively analyzes the flaws in the current education system and highlights the importance of adapting to the changing times. the essay is well-structured, with a clear introduction, body, and conclusion, and the writer uses relevant examples and quotes to support their points. the writing is clear and concise, with minimal errors in grammar and punctuation. the only area for improvement is in providing more nuanced and balanced arguments, as some points are presented in a somewhat binary manner. overall, this is an excellent essay that demonstrates a high level of understanding and critical thinking.",92.0,"this essay demonstrates a deep understanding of the topic, presenting a clear and well-supported argument that education is still crucial for a nation's success. the writer effectively analyzes the flaws in the current education system and highlights the importance of adapting to the changing times. the essay is well-structured, with a clear introduction, body, and conclusion, and the writer uses relevant examples and quotes to support their points. the writing is clear and concise, with minimal errors in grammar and punctuation. the only area for improvement is in providing more nuanced and balanced arguments, as some points are presented in a somewhat binary manner. overall, this is an excellent essay that demonstrates a high level of understanding and critical thinking.",22.0
Wen Ying,Raffles Institution,2019,"In the light of increasing security threats, should countries still embrace the notion of a borderless world?",off_topic,"In the light of increasing security threats, countries are faced with the dilemma of whether to embrace the notion of a borderless world. While some argue that a borderless world would lead to increased security threats, others believe that it would bring about significant economic benefits. However, I would like to take a step back and examine the concept of nostalgia. Nostalgia is a sentimental longing or wistful affection for the past, typically for a period or place with happy personal associations. It is a universal human emotion that transcends cultural and geographical boundaries.

In recent years, there has been a resurgence of interest in nostalgia, with many people seeking comfort in the familiar and the nostalgic. This can be seen in the rise of vintage clothing, antique furniture, and classic films. People are drawn to these things because they evoke a sense of nostalgia, a sense of comfort and security. But what is the root cause of this nostalgia? Is it a response to the rapid pace of modern life? Is it a longing for a simpler, more innocent time?

One possible explanation is that nostalgia is a coping mechanism for dealing with the stresses of modern life. In a world that is increasingly fast-paced and uncertain, people are seeking comfort in the familiar and the nostalgic. This can be seen in the rise of social media, where people share nostalgic memories and connect with others who share similar experiences.

In conclusion, while the notion of a borderless world is an important issue, it is also important to consider the role of nostalgia in our lives. Nostalgia is a powerful emotion that can bring people together and provide comfort in times of uncertainty. As we navigate the complexities of modern life, it is essential that we take a step back and appreciate the beauty of nostalgia.",18,36.0,"Score: 25/100
Explanation: The essay completely misses the point of the prompt. While it defines nostalgia and discusses its role in modern life, it fails to connect this concept to the central question of borderless worlds and security threats. The essay demonstrates a lack of understanding of the topic and provides irrelevant information. The structure is present, but the content is off-topic.
*   **Understanding and Application of Knowledge:** 2/30 - Demonstrates very little understanding of the essay topic. The information is irrelevant.
*   **Analysis and Evaluation:** 2/30 - No analysis or evaluation of the central question.
*   **Clarity and Communication:** 15/30 - The writing is clear and uses appropriate vocabulary, but it's all applied to an irrelevant topic.
*   **Structure and Organization:** 6/10 - The essay has a basic structure (introduction, body, conclusion), but the content within is not logically connected to the prompt.
",25.0,"The essay completely misses the point of the prompt. While it defines nostalgia and discusses its role in modern life, it fails to connect this concept to the central question of borderless worlds and security threats. The essay demonstrates a lack of understanding of the topic and provides irrelevant information. The structure is present, but the content is off-topic.
Understanding and Application of Knowledge: 2/30 - Demonstrates very little understanding of the essay topic. The information is irrelevant.
Analysis and Evaluation: 2/30 - No analysis or evaluation of the central question.
Clarity and Communication: 15/30 - The writing is clear and uses appropriate vocabulary, but it's all applied to an irrelevant topic.
Structure and Organization: 6/10 - The essay has a basic structure (introduction, body, conclusion), but the content within is not logically connected to the prompt.",11.0,"Score: 35/100
Explanation: The essay fails to address the prompt directly. It introduces the concept of nostalgia, which is irrelevant to the question of whether countries should embrace a borderless world in light of increasing security threats. The essay demonstrates a lack of understanding of the topic and fails to provide any analysis or evaluation of the arguments for or against a borderless world. The structure is weak, and the essay lacks a clear thesis statement and supporting evidence.
",35.0,"The essay fails to address the prompt directly. It introduces the concept of nostalgia, which is irrelevant to the question of whether countries should embrace a borderless world in light of increasing security threats. The essay demonstrates a lack of understanding of the topic and fails to provide any analysis or evaluation of the arguments for or against a borderless world. The structure is weak, and the essay lacks a clear thesis statement and supporting evidence.",1.0,"score: 40
essay_id: in the light of increasing security threats, should countries still embrace the notion of a borderless world?
explanation: the essay fails to address the topic question and instead explores the concept of nostalgia, which is unrelated to the topic. although the writing is clear and coherent, the essay lacks relevance to the question, and the student's effort is not rewarded with a higher score.",40.0,"the essay fails to address the topic question and instead explores the concept of nostalgia, which is unrelated to the topic. although the writing is clear and coherent, the essay lacks relevance to the question, and the student's effort is not rewarded with a higher score.",4.0
Skyler,Hwa Chong Institution,2021,Do you agree that freedom of speech should never be denied even though it can be abused?,llama,"The freedom of speech is a fundamental right that is supposd to be protected at all cost. However, there are instances where this right can be abused and cause harm to the society. The question is, should the freedom of speech be denied in such circumstances. In my opnion, yes it should.

Firstly, the freedom of speech can cause harm to the society. For example, hate speech can lead to violence and unrest in the society. It can also lead to the marginalization of certain groups of people. This can be seen in the case of the Capitol storming in the US, where Donald Trump's speech incited violence and led to the loss of innocent lives. Therefore, in such instances, the freedom of speech should be denied.

Secondly, the freedom of speech can lead to the spread of misinformation. This can be seen in the case of fake news, where false information is spread to mislead the public. This can have severe consequences, such as in the case of the COVID-19 pandemic, where misinformation led to vaccine hesitancy and skepticism towards government institutions. Therefore, the freedom of speech should be denied in such instances.

Thirdly, the freedom of speech can harm the vulnerable. For example, hate speech towards minorities can lead to feelings of fear and insecurity. This can be seen in the case of racial and religous minorities, who are often the target of hate speech. Therefore, the freedom of speech should be denied in such instances.

Some may argue that the freedom of speech is an absolute right and should never be denied. However, I believe that the freedom of speech should be denied when it causes harm to the society. The right to free speech is not more important than the right to live in a safe and secure society.

In conclusion, the freedom of speech is a fundamental right, but it should not be absolute. It should be denied when it causes harm to the society, leads to the spread of misinformation, or harms the vulnerable. The right to free speech should be balanced with the right to live in a safe and secure society.",35,70.0,"Score: 68/100
Explanation: The essay presents a clear argument against absolute freedom of speech, citing relevant examples like hate speech and misinformation. However, the analysis could be deeper, exploring counterarguments more thoroughly and providing more nuanced perspectives. The structure is logical, but the language contains some errors and lacks sophistication.
*   **Understanding and Application of Knowledge (20/30):** Demonstrates understanding of the topic and provides relevant examples (Capitol storming, COVID-19 misinformation). However, the depth of knowledge could be greater, and the examples could be explored in more detail.
*   **Analysis and Evaluation (18/30):** Presents arguments for restricting freedom of speech but lacks a comprehensive evaluation of different perspectives. The counterargument is acknowledged but not thoroughly addressed.
*   **Clarity and Communication (20/30):** The essay is generally clear, but the language is somewhat simplistic and contains grammatical errors (""opnion,"" ""religous,"" ""supposd""). Vocabulary range is limited.
*   **Structure and Organization (10/10):** The essay follows a logical structure with a clear introduction, body paragraphs, and conclusion. The arguments are presented in a coherent manner.
",68.0,"The essay presents a clear argument against absolute freedom of speech, citing relevant examples like hate speech and misinformation. However, the analysis could be deeper, exploring counterarguments more thoroughly and providing more nuanced perspectives. The structure is logical, but the language contains some errors and lacks sophistication.
Understanding and Application of Knowledge (20/30): Demonstrates understanding of the topic and provides relevant examples (Capitol storming, COVID-19 misinformation). However, the depth of knowledge could be greater, and the examples could be explored in more detail.
Analysis and Evaluation (18/30): Presents arguments for restricting freedom of speech but lacks a comprehensive evaluation of different perspectives. The counterargument is acknowledged but not thoroughly addressed.
Clarity and Communication (20/30): The essay is generally clear, but the language is somewhat simplistic and contains grammatical errors (""opnion,"" ""religous,"" ""supposd""). Vocabulary range is limited.
Structure and Organization (10/10): The essay follows a logical structure with a clear introduction, body paragraphs, and conclusion. The arguments are presented in a coherent manner.",2.0,"Score: 55/100
Explanation: The essay demonstrates a basic understanding of the topic and presents some relevant examples. However, the analysis is superficial, and the arguments are not well-developed. The writing is clear but lacks sophistication, and the structure is simple but functional. The essay could benefit from more in-depth analysis, stronger evidence, and a more nuanced discussion of counterarguments.
",55.0,"The essay demonstrates a basic understanding of the topic and presents some relevant examples. However, the analysis is superficial, and the arguments are not well-developed. The writing is clear but lacks sophistication, and the structure is simple but functional. The essay could benefit from more in-depth analysis, stronger evidence, and a more nuanced discussion of counterarguments.",15.0,"score: 82
essay_id: do you agree that freedom of speech should never be denied even though it can be abused?
explanation: this essay demonstrates a good understanding of the topic and presents relevant examples to support the argument. the structure is clear, and the writer effectively links their points to the question. however, there are some areas for improvement, such as the lack of depth in analysis and evaluation, and some minor errors in grammar and spelling. the writer could also benefit from more nuanced and original ideas to strengthen their argument. overall, this is a good effort, but it could be further developed to achieve a higher score.",82.0,"this essay demonstrates a good understanding of the topic and presents relevant examples to support the argument. the structure is clear, and the writer effectively links their points to the question. however, there are some areas for improvement, such as the lack of depth in analysis and evaluation, and some minor errors in grammar and spelling. the writer could also benefit from more nuanced and original ideas to strengthen their argument. overall, this is a good effort, but it could be further developed to achieve a higher score.",12.0
