author,school,year_written,title,type,text,score,score_out_of_100,grading_basic,score_basic_model,explanation_basic_model,loss_basic_model,grading_gemini,score_gemini,explanation_gemini,loss_gemini,grading_llama,score_llama,explanation_llama,loss_llama
Huang Junwei,HCI,2020,Should everyone be treated equally all the time?,llama,"Should everyone be treated equally all the time? This is a question that has been debated by many peoples for a long time. In my opinion, everyone should be treated fairly, but not necessarily equally. 

Firstly, treating everyone equally doesn't always mean treating them fairly. For example, in a classroom, if a student is struggling with math, giving them the same amount of homework as the other students who are doing well in math is not fair. The student who is struggling need more help and support, so giving them the same amount of homework is not helpful to them. 

Secondly, if everyone is treated equally, it can lead to laziness. If everyone get the same amount of money regardless of how hard they work, then why bother to work hard? People will just do the minimum amount of work and still get paid the same. This will lead to a decrease in productivity and the economy will suffer. 

However, there are certain situations where everyone should be treated equally. For example, in the workplace, everyone should be treated equally regardless of their race, gender, or religion. No one should be discriminated against because of who they are. 

In conclusion, treating everyone equally is not always the best solution. It's more important to treat people fairly and based on their individual needs. This way, everyone will have an equal opportunity to succeed.",32,64.0,"Score: 75/100

Explanation:
*   **Understanding and Application of Knowledge (20/30):** The essay demonstrates a basic understanding of the concept of equality versus fairness. The classroom example is relevant and illustrates the point. However, the depth of understanding could be improved with more nuanced examples and a broader exploration of the topic.
*   **Analysis and Evaluation (20/30):** The essay presents a simple argument with two main points. The analysis of the ""laziness"" argument is somewhat simplistic. While the counter-argument regarding workplace discrimination is valid, it could be explored in more depth. The conclusion is reasonable but lacks a strong, insightful synthesis.
*   **Clarity and Communication (20/30):** The writing is generally clear and easy to understand. However, there are some grammatical errors (""peoples,"" ""get"" instead of ""gets"") and a limited range of vocabulary. The register is appropriate for the task.
*   **Structure and Organization (15/20):** The essay has a clear structure with an introduction, body paragraphs, and a conclusion. The paragraphs are logically organized, and the flow of ideas is generally smooth. However, the transitions between paragraphs could be improved to create a more cohesive argument.
",75.0,"Understanding and Application of Knowledge (20/30): The essay demonstrates a basic understanding of the concept of equality versus fairness. The classroom example is relevant and illustrates the point. However, the depth of understanding could be improved with more nuanced examples and a broader exploration of the topic.
Analysis and Evaluation (20/30): The essay presents a simple argument with two main points. The analysis of the ""laziness"" argument is somewhat simplistic. While the counter-argument regarding workplace discrimination is valid, it could be explored in more depth. The conclusion is reasonable but lacks a strong, insightful synthesis.
Clarity and Communication (20/30): The writing is generally clear and easy to understand. However, there are some grammatical errors (""peoples,"" ""get"" instead of ""gets"") and a limited range of vocabulary. The register is appropriate for the task.
Structure and Organization (15/20): The essay has a clear structure with an introduction, body paragraphs, and a conclusion. The paragraphs are logically organized, and the flow of ideas is generally smooth. However, the transitions between paragraphs could be improved to create a more cohesive argument.",11.0,"Score: 55/100
Explanation: The essay demonstrates a basic understanding of the topic, arguing that fairness is more important than strict equality. It provides simple examples to support its points, such as the classroom homework scenario and the potential for laziness if everyone receives the same reward regardless of effort. However, the analysis lacks depth and critical evaluation. The arguments are somewhat simplistic and could benefit from more nuanced perspectives. The essay is clearly written and organized, but the vocabulary and sentence structure are basic. The structure is adequate, with an introduction, body paragraphs, and a conclusion, but the transitions between ideas could be smoother.
",55.0,"The essay demonstrates a basic understanding of the topic, arguing that fairness is more important than strict equality. It provides simple examples to support its points, such as the classroom homework scenario and the potential for laziness if everyone receives the same reward regardless of effort. However, the analysis lacks depth and critical evaluation. The arguments are somewhat simplistic and could benefit from more nuanced perspectives. The essay is clearly written and organized, but the vocabulary and sentence structure are basic. The structure is adequate, with an introduction, body paragraphs, and a conclusion, but the transitions between ideas could be smoother.",9.0,"score: 82
essay_id: should everyone be treated equally all the time?
explanation: this essay demonstrates a good understanding of the topic and presents relevant examples to support the argument. the writer clearly distinguishes between treating people equally and treating them fairly, and provides a nuanced discussion on the importance of considering individual needs. the essay is well-organized, and the language is clear and concise. however, the analysis could be more in-depth, and the writer could have explored more counterarguments to strengthen their position. additionally, some of the sentences are a bit simplistic, and the vocabulary could be more varied. overall, this is a strong essay that demonstrates a good understanding of the topic.",82.0,"this essay demonstrates a good understanding of the topic and presents relevant examples to support the argument. the writer clearly distinguishes between treating people equally and treating them fairly, and provides a nuanced discussion on the importance of considering individual needs. the essay is well-organized, and the language is clear and concise. however, the analysis could be more in-depth, and the writer could have explored more counterarguments to strengthen their position. additionally, some of the sentences are a bit simplistic, and the vocabulary could be more varied. overall, this is a strong essay that demonstrates a good understanding of the topic.",18.0
Chirin Soh,Raffles Institution,2020,Do you agree that we cannot trust the media?,gemma2,"Do you agree that we cannot trust the media? This is a big question, and I think it's something everyone should think about.  Media is everywhere, on TV, in newspapers, even our phones! It tells us what's happening in the world, but can we really believe everything we see and hear?

Some people say yes, the media is trustworthy. They say journalists are ethical and want to tell the truth. But I think there are too many reasons why we should be skeptical. For example, have you ever seen a news story that just seemed too good to be true? Or maybe one that felt biased towards a certain person or group? That's because sometimes the media has an agenda, and they might twist the facts to fit their narrative.

Also, think about all the different kinds of media there is. You have your big news corporations, but then you have blogs, social media, even YouTube channels claiming to be ""news.""  It's hard to know who to believe anymore! And with so much fake news out there, it's easy to get caught up in something that isn't real.

Remember the story about Hillary Clinton and the pizza place? That was totally made up, but people believed it and even acted on it!  That's how dangerous fake news can be. 

The media used to be more trustworthy, I think. Back in the day, there were fewer outlets, and reporters had to do more fact-checking. Now, everything moves so fast, and it's hard to keep up. People just want to share things online, without thinking about whether they're true or not.

So, what can we do? Well, I think it's important to be critical of what you see and hear in the media. Don't just believe everything you read! Check your sources, look for different perspectives, and be aware of potential biases.",23,46.0,"Score: 72/100
Explanation: The essay demonstrates a reasonable understanding of the topic and presents some relevant examples, such as the ""pizza gate"" conspiracy. The student offers a clear opinion and supports it with arguments about bias and fake news. However, the analysis could be deeper, and the essay lacks specific examples of media bias beyond the one mentioned. The structure is logical, but the language is somewhat simplistic and lacks sophistication.
*   **Understanding and Application of Knowledge (20/30):** Shows understanding of the topic but lacks depth. The ""pizza gate"" example is relevant, but more diverse examples would strengthen the argument.
*   **Analysis and Evaluation (18/30):** Identifies issues like bias and fake news but the analysis is somewhat superficial. The essay presents a clear opinion but doesn't explore counter-arguments in detail.
*   **Clarity and Communication (24/30):** The writing is clear and easy to understand, but the vocabulary is limited, and the register is informal. The essay is generally coherent.
*   **Structure and Organization (10/10):** The essay has a clear introduction, body paragraphs, and conclusion, with a logical flow of ideas.
",72.0,"The essay demonstrates a reasonable understanding of the topic and presents some relevant examples, such as the ""pizza gate"" conspiracy. The student offers a clear opinion and supports it with arguments about bias and fake news. However, the analysis could be deeper, and the essay lacks specific examples of media bias beyond the one mentioned. The structure is logical, but the language is somewhat simplistic and lacks sophistication.
Understanding and Application of Knowledge (20/30): Shows understanding of the topic but lacks depth. The ""pizza gate"" example is relevant, but more diverse examples would strengthen the argument.
Analysis and Evaluation (18/30): Identifies issues like bias and fake news but the analysis is somewhat superficial. The essay presents a clear opinion but doesn't explore counter-arguments in detail.
Clarity and Communication (24/30): The writing is clear and easy to understand, but the vocabulary is limited, and the register is informal. The essay is generally coherent.
Structure and Organization (10/10): The essay has a clear introduction, body paragraphs, and conclusion, with a logical flow of ideas.",26.0,"Score: 55/100
Explanation: The essay demonstrates a basic understanding of the topic but lacks depth and specific examples. The analysis is superficial, and the arguments are not well-developed. The writing is clear but lacks sophistication and precision. The structure is simple but coherent.
- Understanding and Application of Knowledge: 15/30
- Analysis and Evaluation: 15/30
- Clarity and Communication: 15/30
- Structure and Organization: 10/10
",55.0,"The essay demonstrates a basic understanding of the topic but lacks depth and specific examples. The analysis is superficial, and the arguments are not well-developed. The writing is clear but lacks sophistication and precision. The structure is simple but coherent.
- Understanding and Application of Knowledge: 15/30
- Analysis and Evaluation: 15/30
- Clarity and Communication: 15/30
- Structure and Organization: 10/10",9.0,"score: 82
essay_id: do you agree that we cannot trust the media?
explanation: this essay demonstrates a good understanding of the topic, with the student presenting both sides of the argument. the student provides some relevant examples, such as the hillary clinton pizza place story, to support their points. the essay is well-structured and easy to follow, with a clear introduction, body, and conclusion. however, the analysis and evaluation of the topic could be more in-depth, and the student could have provided more nuanced arguments. additionally, the language and vocabulary used are not overly complex, which detracts from the overall quality of the essay. nevertheless, the student has made a good effort to address the question and provide some thoughtful insights.",82.0,"this essay demonstrates a good understanding of the topic, with the student presenting both sides of the argument. the student provides some relevant examples, such as the hillary clinton pizza place story, to support their points. the essay is well-structured and easy to follow, with a clear introduction, body, and conclusion. however, the analysis and evaluation of the topic could be more in-depth, and the student could have provided more nuanced arguments. additionally, the language and vocabulary used are not overly complex, which detracts from the overall quality of the essay. nevertheless, the student has made a good effort to address the question and provide some thoughtful insights.",36.0
Wen Ying,Raffles Institution,2019,How has technology impacted health in today’s world?,gemma2,"Technology has changed how we live, and it's impacted our health too. Like, everyone uses phones and computers now, so we're always online. This is bad 'cause it makes us less active and more likely to be overweight. We order food all the time instead of cooking, and we just sit around playing games or watching videos. It's not good for our bodies!

But technology also has some good things about it. Doctors can use fancy machines to see inside our bodies and find problems. They can also talk to other doctors online to get advice on how to treat us. This helps people get better faster and live longer. Plus, there are apps that can track our steps and remind us to exercise.

Technology is also helping scientists learn more about diseases. They can use computers to simulate how drugs work in the body before they even test them on humans. This saves time and money, and it could lead to new cures for diseases like cancer. 

So, technology has both good and bad effects on our health. It's important to be aware of both sides so we can make healthy choices. Like, we should still go outside and play, even if it means putting down our phones sometimes!",23,46.0,"Score: 65/100
Explanation: The essay demonstrates a basic understanding of the topic, identifying both positive and negative impacts of technology on health. However, the analysis lacks depth and critical evaluation. The language is simple and the structure is adequate but not particularly sophisticated.
*   **Understanding and Application of Knowledge (18/30):** The essay shows a basic understanding of the topic, mentioning inactivity, advanced medical equipment, and drug simulations. However, the examples are quite general and lack specific details.
*   **Analysis and Evaluation (15/30):** The essay identifies both positive and negative impacts but doesn't delve deeply into the complexities or provide a nuanced evaluation of different perspectives. The arguments are somewhat simplistic.
*   **Clarity and Communication (22/30):** The writing is clear and easy to understand, but the vocabulary is limited and the register is informal (""Like, everyone uses phones""). The organization is logical, but the transitions could be smoother.
*   **Structure and Organization (10/10):** The essay has a clear introduction, body paragraphs, and conclusion, with a logical flow of ideas.
",65.0,"The essay demonstrates a basic understanding of the topic, identifying both positive and negative impacts of technology on health. However, the analysis lacks depth and critical evaluation. The language is simple and the structure is adequate but not particularly sophisticated.
Understanding and Application of Knowledge (18/30): The essay shows a basic understanding of the topic, mentioning inactivity, advanced medical equipment, and drug simulations. However, the examples are quite general and lack specific details.
Analysis and Evaluation (15/30): The essay identifies both positive and negative impacts but doesn't delve deeply into the complexities or provide a nuanced evaluation of different perspectives. The arguments are somewhat simplistic.
Clarity and Communication (22/30): The writing is clear and easy to understand, but the vocabulary is limited and the register is informal (""Like, everyone uses phones""). The organization is logical, but the transitions could be smoother.
Structure and Organization (10/10): The essay has a clear introduction, body paragraphs, and conclusion, with a logical flow of ideas.",19.0,"Score: 55/100
Explanation: The essay demonstrates a basic understanding of the topic, identifying both positive and negative impacts of technology on health. However, the analysis lacks depth and the examples are simplistic and not fully developed. The language is informal and lacks the sophistication expected at a higher level. The structure is adequate, but the arguments could be more logically linked and better supported.
",55.0,"The essay demonstrates a basic understanding of the topic, identifying both positive and negative impacts of technology on health. However, the analysis lacks depth and the examples are simplistic and not fully developed. The language is informal and lacks the sophistication expected at a higher level. The structure is adequate, but the arguments could be more logically linked and better supported.",9.0,"score: 72
essay_id: how has technology impacted health in today’s world?
explanation: this essay demonstrates a good understanding of the topic, presenting both positive and negative impacts of technology on health. the student provides relevant examples, such as the use of fancy machines in healthcare and apps for tracking physical activity. however, the essay lacks depth and analysis, with some points being superficially discussed. the structure and organization are clear, but the language is simple, and the vocabulary is limited. overall, the essay is well-intentioned but could benefit from more development and nuance in its arguments.",72.0,"this essay demonstrates a good understanding of the topic, presenting both positive and negative impacts of technology on health. the student provides relevant examples, such as the use of fancy machines in healthcare and apps for tracking physical activity. however, the essay lacks depth and analysis, with some points being superficially discussed. the structure and organization are clear, but the language is simple, and the vocabulary is limited. overall, the essay is well-intentioned but could benefit from more development and nuance in its arguments.",26.0
Stephanie Heng,Raffles Institution,2019,Can the media ever tell the truth?,llama,"Can the Media Ever Tell the Truth?

The media has been a vital part of our lifes for a long time. It has the power to shape our mindsets and perceptions. However, there is a growing concern about the truthfulness of the media. Some people believe that the media never tell the truth, while others think that it can be a powerful tool for empowerment. In my opinion, the media can tell the truth, but it is not always the case.

One of the main reasons why people doubt the media is because of its subjective nature. The media is not just about reporting facts, it also involves analysis and interpretation of information. This means that the media is prone to human bias, which can lead to inaccurate reporting. For example, the same event can be reported differently by different news channels, depending on their political leanings. This can be misleading and can create confusion among the public.

Another reason why people question the media's credibility is because of its commercial nature. The media is a business, and like any business, it is driven by profit. This means that the media can be selective in the information it reports, and may prioritize sensationalism over accuracy. This can lead to the misrepresentation of facts and the spread of false information.

However, despite these flaws, I believe that the media can still tell the truth. There are many instances where the media has played a crucial role in exposing injustices and bringing about positive change. For example, investigative journalism has been instrumental in uncovering corruption and abuse of power. The media has also given a voice to marginalized communities and has helped to bring about social change.

The rise of new media has also changed the way we consume information. With the internet and social media, we have access to a wide range of sources of information. This has made it easier for us to verify the accuracy of information and to make informed decisions. New media has also given people the power to express themselves and to share their stories, which has helped to promote diversity and inclusivity.

In conclusion, while the media is not perfect, I believe that it can tell the truth. The media has the power to shape our perceptions and to bring about positive change. However, it is up to us to be critical consumers of information and to verify the accuracy of what we read and see.",32,64.0,"Score: 72/100
Explanation: The essay demonstrates a reasonable understanding of the topic and presents a balanced argument. It acknowledges the potential for bias and commercial influence in media reporting but also highlights the media's positive role in exposing injustices and promoting social change. The structure is clear, with an introduction, body paragraphs presenting different perspectives, and a conclusion. However, the analysis could be deeper, and the examples provided are somewhat generic. The language is generally accurate, but the vocabulary could be more varied.
",72.0,"The essay demonstrates a reasonable understanding of the topic and presents a balanced argument. It acknowledges the potential for bias and commercial influence in media reporting but also highlights the media's positive role in exposing injustices and promoting social change. The structure is clear, with an introduction, body paragraphs presenting different perspectives, and a conclusion. However, the analysis could be deeper, and the examples provided are somewhat generic. The language is generally accurate, but the vocabulary could be more varied.",8.0,"Score: 65/100
Explanation: The essay demonstrates a basic understanding of the topic and presents some relevant arguments. However, the analysis lacks depth and critical evaluation. The essay is clearly written but could benefit from more specific examples and a more sophisticated vocabulary. The structure is logical, but the arguments are not always effectively linked.
",65.0,"The essay demonstrates a basic understanding of the topic and presents some relevant arguments. However, the analysis lacks depth and critical evaluation. The essay is clearly written but could benefit from more specific examples and a more sophisticated vocabulary. The structure is logical, but the arguments are not always effectively linked.",1.0,"score: 85
essay_id: can the media ever tell the truth?
explanation: this essay demonstrates a good understanding of the topic, with relevant examples and a clear structure. the writer presents a balanced view, acknowledging the limitations of the media while also highlighting its potential to tell the truth. the essay is well-organized, with a clear introduction, body, and conclusion. the language is clear and concise, with some good vocabulary and sentence structures. however, the essay could benefit from more depth and analysis in some areas, and some of the points could be more fully developed. additionally, there are some minor errors in grammar and punctuation. overall, this is a strong essay that demonstrates a good understanding of the topic.",85.0,"this essay demonstrates a good understanding of the topic, with relevant examples and a clear structure. the writer presents a balanced view, acknowledging the limitations of the media while also highlighting its potential to tell the truth. the essay is well-organized, with a clear introduction, body, and conclusion. the language is clear and concise, with some good vocabulary and sentence structures. however, the essay could benefit from more depth and analysis in some areas, and some of the points could be more fully developed. additionally, there are some minor errors in grammar and punctuation. overall, this is a strong essay that demonstrates a good understanding of the topic.",21.0
