author,school,year_written,title,type,text,score,score_out_of_100,grading_basic,score_basic_model,explanation_basic_model,loss_basic_model,grading_gemini,score_gemini,explanation_gemini,loss_gemini,grading_llama,score_llama,explanation_llama,loss_llama
Skyler,Hwa Chong Institution,2021,Do you agree that freedom of speech should never be denied even though it can be abused?,gemma2,"Freedom of speech is really important, like, super duper important.  Everyone should be able to say what they think, right? But sometimes people use their words to hurt other people. Like, imagine if your friend said something mean about you to everyone. That would make you feel bad, wouldn't it?

Some people say that we should never stop anyone from talking, even if what they say is wrong. They say that it's important for people to be able to express themselves freely. But I think it's also important to protect people from being hurt. 

For example, imagine someone spreading rumors about another person online. That could really damage that person's reputation and make their life miserable. Or what if someone uses their words to incite violence? That could lead to real harm and danger.

I think it's important to find a balance between freedom of speech and protecting people from harm. We need to be able to speak our minds, but we also need to be responsible for the words we choose. 

Sometimes, it might be necessary to limit someone's freedom of speech if they are using it to hurt others. It's like when you break a rule at school – sometimes you have to get in trouble so that everyone can stay safe and happy.",25,50.0,"Score: 55/100

Explanation:

*   **Understanding and Application of Knowledge (15/30):** The essay demonstrates a basic understanding of freedom of speech and its potential for abuse. The examples provided are relevant, but simplistic and lack depth. The student understands the core issue but doesn't demonstrate a nuanced grasp of the complexities involved.
*   **Analysis and Evaluation (15/30):** The essay presents a rudimentary analysis of the tension between freedom of speech and the need to protect individuals from harm. It acknowledges different perspectives but doesn't critically evaluate them in a sophisticated manner. The conclusion is somewhat supported but lacks strong reasoning.
*   **Clarity and Communication (15/30):** The language used is informal and lacks the register expected of an academic essay. Vocabulary is limited, and the writing style is conversational rather than analytical. While the essay is understandable, the clarity and precision of communication are weak.
*   **Structure and Organization (10/10):** The essay follows a logical structure with an introduction, body paragraphs presenting arguments, and a conclusion. The flow of ideas is generally coherent, and the paragraphs are reasonably well-linked.
",55.0,"Understanding and Application of Knowledge (15/30): The essay demonstrates a basic understanding of freedom of speech and its potential for abuse. The examples provided are relevant, but simplistic and lack depth. The student understands the core issue but doesn't demonstrate a nuanced grasp of the complexities involved.
Analysis and Evaluation (15/30): The essay presents a rudimentary analysis of the tension between freedom of speech and the need to protect individuals from harm. It acknowledges different perspectives but doesn't critically evaluate them in a sophisticated manner. The conclusion is somewhat supported but lacks strong reasoning.
Clarity and Communication (15/30): The language used is informal and lacks the register expected of an academic essay. Vocabulary is limited, and the writing style is conversational rather than analytical. While the essay is understandable, the clarity and precision of communication are weak.
Structure and Organization (10/10): The essay follows a logical structure with an introduction, body paragraphs presenting arguments, and a conclusion. The flow of ideas is generally coherent, and the paragraphs are reasonably well-linked.",5.0,"Score: 45/100
Explanation: The essay demonstrates a basic understanding of the topic but lacks depth and analytical rigor. The arguments are simplistic and lack supporting evidence or examples. The language is informal and lacks the sophistication expected at a higher educational level. The structure is rudimentary, with a weak introduction and conclusion.
- Understanding and Application of Knowledge: 15/30 - Demonstrates a basic understanding of the concept of freedom of speech but lacks depth. The examples are simplistic and not well-developed.
- Analysis and Evaluation: 10/30 - The analysis is superficial, and the arguments are not well-developed or critically evaluated.
- Clarity and Communication: 15/30 - The language is informal and lacks precision. The writing is coherent but lacks sophistication.
- Structure and Organization: 5/10 - The essay has a basic structure, but the flow of ideas is not always logical or well-connected.
",45.0,"The essay demonstrates a basic understanding of the topic but lacks depth and analytical rigor. The arguments are simplistic and lack supporting evidence or examples. The language is informal and lacks the sophistication expected at a higher educational level. The structure is rudimentary, with a weak introduction and conclusion.
- Understanding and Application of Knowledge: 15/30 - Demonstrates a basic understanding of the concept of freedom of speech but lacks depth. The examples are simplistic and not well-developed.
- Analysis and Evaluation: 10/30 - The analysis is superficial, and the arguments are not well-developed or critically evaluated.
- Clarity and Communication: 15/30 - The language is informal and lacks precision. The writing is coherent but lacks sophistication.
- Structure and Organization: 5/10 - The essay has a basic structure, but the flow of ideas is not always logical or well-connected.",5.0,"score: 60
essay_id: do you agree that freedom of speech should never be denied even though it can be abused?
explanation: this essay demonstrates a good understanding of the topic and presents some relevant examples to support the argument. however, the writing is simplistic, and the ideas are not well-developed or supported with evidence. the structure and organization of the essay are also somewhat lacking, with abrupt transitions between paragraphs. additionally, the language and vocabulary used are limited, which affects the overall clarity and coherence of the essay. despite these limitations, the essay shows some promise and demonstrates an attempt to engage with the topic.",60.0,"this essay demonstrates a good understanding of the topic and presents some relevant examples to support the argument. however, the writing is simplistic, and the ideas are not well-developed or supported with evidence. the structure and organization of the essay are also somewhat lacking, with abrupt transitions between paragraphs. additionally, the language and vocabulary used are limited, which affects the overall clarity and coherence of the essay. despite these limitations, the essay shows some promise and demonstrates an attempt to engage with the topic.",10.0
Chirin Soh,Raffles Institution,2019,Consumerism is a curse on the environment. Discuss.,off_topic,"Consumerism is a curse on the environment. Discuss.

In today's society, the concept of happiness is often misconstrued. Many people believe that happiness can be achieved through material possessions and wealth. However, this is not the case. Happiness comes from within and can be achieved through self-reflection and gratitude. For instance, many people are not grateful for what they have and are always yearning for more. This can lead to a sense of dissatisfaction and unhappiness. Furthermore, people often compare themselves to others and feel inferior if they do not have the same possessions or status. This can lead to feelings of jealousy and resentment.

In addition, the pursuit of happiness through material possessions can also lead to a sense of emptiness. Many people feel that they need to constantly buy new things to feel happy, but this happiness is short-lived. Once the newness of the possession wears off, the individual is left feeling unfulfilled and empty. This can lead to a cycle of constant consumption and waste.

On a separate note, the concept of time is also often misunderstood. Many people believe that time is a linear concept and that we have all the time in the world. However, this is not the case. Time is limited and we should make the most of it. We should focus on the present moment and make the most of the time we have. This can be achieved through mindfulness and living in the present.

In conclusion, the concept of happiness and time are often misconstrued in today's society. We should focus on self-reflection, gratitude, and mindfulness to achieve true happiness. We should also make the most of the time we have and focus on the present moment.",15,30.0,"Score: 25/100
Explanation: The essay demonstrates a very limited understanding of the prompt. It veers off-topic, discussing happiness and time management rather than directly addressing consumerism's impact on the environment. The arguments presented are not well-developed, lack supporting evidence, and fail to analyze the complexities of the issue. The structure is weak, with a lack of clear connections between paragraphs and a conclusion that doesn't effectively summarize the main points related to the prompt. The essay lacks focus on the keywords of the question.
",25.0,"The essay demonstrates a very limited understanding of the prompt. It veers off-topic, discussing happiness and time management rather than directly addressing consumerism's impact on the environment. The arguments presented are not well-developed, lack supporting evidence, and fail to analyze the complexities of the issue. The structure is weak, with a lack of clear connections between paragraphs and a conclusion that doesn't effectively summarize the main points related to the prompt. The essay lacks focus on the keywords of the question.",5.0,"Score: 25/100
Explanation: The essay fails to address the prompt, ""Consumerism is a curse on the environment."" It discusses happiness, material possessions, and time, but does not link these concepts to environmental issues or consumerism's impact on the environment. The essay demonstrates a lack of understanding of the topic and provides irrelevant information. The structure is weak, and the arguments are not logically connected to the prompt.
",25.0,"The essay fails to address the prompt, ""Consumerism is a curse on the environment."" It discusses happiness, material possessions, and time, but does not link these concepts to environmental issues or consumerism's impact on the environment. The essay demonstrates a lack of understanding of the topic and provides irrelevant information. The structure is weak, and the arguments are not logically connected to the prompt.",5.0,"score: 40
essay_id: consumerism is a curse on the environment. discuss.
explanation: the essay fails to address the topic of consumerism and its impact on the environment. instead, it discusses the concept of happiness and time, which is unrelated to the topic. although the essay is well-structured and easy to follow, it lacks relevance and focus on the topic. the student has made an effort to write a coherent essay, but it is off-topic, which is a significant flaw.",40.0,"the essay fails to address the topic of consumerism and its impact on the environment. instead, it discusses the concept of happiness and time, which is unrelated to the topic. although the essay is well-structured and easy to follow, it lacks relevance and focus on the topic. the student has made an effort to write a coherent essay, but it is off-topic, which is a significant flaw.",10.0
Ying,Raffles Institution,2020,‘Protecting the environment is a futile pursuit.’ How far do you agree?,off_topic,"The pursuit of protecting the environment has been a topic of discussion for many years. While some argue that it is a futile pursuit, I believe that it is a crucial effort that requires our attention and dedication. The statistics are alarming, with rising temperatures and melting ice caps, it is clear that something needs to be done. However, I would like to take a step back and talk about something that I think is more pressing, and that is the impact of social media on our mental health.

Social media has become an integral part of our lives, and it is hard to imagine a day without scrolling through our feeds. However, the constant stream of information can be overwhelming, and it has been linked to increased stress and anxiety levels. Furthermore, the curated perfection that is presented on social media can lead to feelings of inadequacy and low self-esteem. It is essential that we take a closer look at the impact of social media on our mental health and take steps to mitigate its negative effects.

One possible solution is to limit our screen time and engage in more outdoor activities. This not only reduces our exposure to social media but also allows us to connect with nature and improve our physical health. Additionally, we can take steps to promote body positivity and self-acceptance on social media platforms. This can be done by sharing unedited and realistic images, and by promoting diverse beauty standards.

In conclusion, while protecting the environment is crucial, I believe that the impact of social media on our mental health is a more pressing issue that requires our attention. By taking small steps to reduce our screen time and promoting positive body image, we can improve our mental health and wellbeing.",18,36.0,"Score: 35/100
Explanation: The essay demonstrates a very limited understanding of the prompt. While it acknowledges the topic of environmental protection, it quickly veers off-topic to discuss social media and mental health, which is irrelevant to the question. The analysis and evaluation are weak, as the arguments presented do not address the core issue of whether environmental protection is futile. The clarity and communication are adequate, but the essay lacks focus and coherence due to the irrelevant content. The structure is basic, but the logical flow is disrupted by the shift in topic.
",35.0,"The essay demonstrates a very limited understanding of the prompt. While it acknowledges the topic of environmental protection, it quickly veers off-topic to discuss social media and mental health, which is irrelevant to the question. The analysis and evaluation are weak, as the arguments presented do not address the core issue of whether environmental protection is futile. The clarity and communication are adequate, but the essay lacks focus and coherence due to the irrelevant content. The structure is basic, but the logical flow is disrupted by the shift in topic.",1.0,"Score: 25/100
Explanation: The essay demonstrates a very poor understanding of the question. It quickly veers off-topic, discussing social media's impact on mental health instead of environmental protection. The analysis and evaluation are completely irrelevant to the prompt. The clarity and communication are adequate within the chosen topic, but the essay fails to address the actual question. The structure is present, but the content is entirely misdirected.
",25.0,"The essay demonstrates a very poor understanding of the question. It quickly veers off-topic, discussing social media's impact on mental health instead of environmental protection. The analysis and evaluation are completely irrelevant to the prompt. The clarity and communication are adequate within the chosen topic, but the essay fails to address the actual question. The structure is present, but the content is entirely misdirected.",11.0,"score: 45
essay_id: ‘protecting the environment is a futile pursuit.’ how far do you agree?
explanation: the essay is off-topic, as it discusses the impact of social media on mental health instead of addressing the question about protecting the environment. although the student has made an effort to present a coherent argument, the essay fails to engage with the topic and does not demonstrate any understanding of the environmental issues. the writing is clear, but the lack of relevance to the question significantly reduces the score.",45.0,"the essay is off-topic, as it discusses the impact of social media on mental health instead of addressing the question about protecting the environment. although the student has made an effort to present a coherent argument, the essay fails to engage with the topic and does not demonstrate any understanding of the environmental issues. the writing is clear, but the lack of relevance to the question significantly reduces the score.",9.0
Chirin Soh,Raffles Institution,2019,Consumerism is a curse on the environment. Discuss.,llama,"Consumerism is a curse on the enviorment. It is a major contributer to the distruction of our planet. The earth is suffeing from the effects of consumerism. The polar ice caps are melting, the seas are rising, and the weather is getting more and more unpredicatable. This is all because of the greed of humans who want to make more and more money. They dont care about the enviorment, they only care about their profits.

Consumerism has led to the distruction of natural habitats. Trees are being cut down, animals are being killed, and the air is being polluted. This is all because of the demand for more and more goods. People want the latest phones, the latest clothes, and the latest gadgets. They dont care about the enviorment, they only care about their own selfish desires.

The goverment is also to blame. They are not doing enought to stop the distruction of the enviorment. They are too busy making deals with big buisnesses to care about the enviorment. They are more concered about making money than saving the planet.

However, there is still hope. If we all work together, we can stop the distruction of the enviorment. We can make a change. We can start by reducing, reusing, and recycling. We can start by using public transport and carpooling. We can start by buying sustainable products.

Many companys are already making a change. They are using sustainable materials, reducing waste, and reducing their carbon footprint. They are showing us that it is posible to make a profit and still care about the enviorment.

In conclusion, consumerism is a curse on the enviorment. It is a major contributer to the distruction of our planet. But it is not too late. We can still make a change. We can still save the enviorment.",30,60.0,"Score: 55/100

Explanation:

*   **Understanding and Application of Knowledge (15/30):** The essay demonstrates a basic understanding of the link between consumerism and environmental issues. However, the examples provided are quite general (melting ice caps, deforestation) and lack depth or specific evidence. The connection between consumerism and these issues is stated rather than thoroughly explained.

*   **Analysis and Evaluation (10/30):** The analysis is weak. The essay presents a simplistic argument blaming consumerism and government without exploring the complexities of the issue. There's little critical evaluation of different perspectives or nuanced understanding of the economic and social factors driving consumerism. The conclusion is a general call to action rather than a supported argument.

*   **Clarity and Communication (20/30):** The writing is relatively clear, but the vocabulary is limited and repetitive (""distruction,"" ""enviorment""). There are several spelling errors (""enviorment,"" ""distruction,"" ""buisnesses,"" ""posible"") and some grammatical issues. The register is appropriate, but the overall quality of the language could be improved.

*   **Structure and Organization (10/10):** The essay follows a basic structure with an introduction, body paragraphs, and conclusion. The ideas are presented in a logical order, and the paragraphs are generally well-defined.
",55.0,"Understanding and Application of Knowledge (15/30): The essay demonstrates a basic understanding of the link between consumerism and environmental issues. However, the examples provided are quite general (melting ice caps, deforestation) and lack depth or specific evidence. The connection between consumerism and these issues is stated rather than thoroughly explained.
Analysis and Evaluation (10/30): The analysis is weak. The essay presents a simplistic argument blaming consumerism and government without exploring the complexities of the issue. There's little critical evaluation of different perspectives or nuanced understanding of the economic and social factors driving consumerism. The conclusion is a general call to action rather than a supported argument.
Clarity and Communication (20/30): The writing is relatively clear, but the vocabulary is limited and repetitive (""distruction,"" ""enviorment""). There are several spelling errors (""enviorment,"" ""distruction,"" ""buisnesses,"" ""posible"") and some grammatical issues. The register is appropriate, but the overall quality of the language could be improved.
Structure and Organization (10/10): The essay follows a basic structure with an introduction, body paragraphs, and conclusion. The ideas are presented in a logical order, and the paragraphs are generally well-defined.",5.0,"Score: 45/100
Explanation: The essay demonstrates a basic understanding of the topic, identifying consumerism as a contributor to environmental destruction. However, the analysis is superficial, lacking depth and specific examples. The arguments are simplistic and not well-developed. The writing is clear but contains errors in spelling and grammar, and the overall structure is rudimentary. The essay touches on potential solutions but without substantial elaboration.
",45.0,"The essay demonstrates a basic understanding of the topic, identifying consumerism as a contributor to environmental destruction. However, the analysis is superficial, lacking depth and specific examples. The arguments are simplistic and not well-developed. The writing is clear but contains errors in spelling and grammar, and the overall structure is rudimentary. The essay touches on potential solutions but without substantial elaboration.",15.0,"score: 72
essay_id: consumerism is a curse on the environment. discuss.
explanation: this essay demonstrates a good understanding of the topic, with relevant examples and a clear structure. the writer presents a clear argument that consumerism is a curse on the environment, citing the destruction of natural habitats, pollution, and climate change. the essay also acknowledges the role of governments and businesses in perpetuating environmental harm. however, the writing lacks depth and nuance, with some simplistic and general statements. additionally, there are some grammatical errors and inconsistencies in language use. the conclusion is somewhat abrupt and lacks a clear call to action. overall, the essay demonstrates a good effort, but could benefit from more development and refinement.",72.0,"this essay demonstrates a good understanding of the topic, with relevant examples and a clear structure. the writer presents a clear argument that consumerism is a curse on the environment, citing the destruction of natural habitats, pollution, and climate change. the essay also acknowledges the role of governments and businesses in perpetuating environmental harm. however, the writing lacks depth and nuance, with some simplistic and general statements. additionally, there are some grammatical errors and inconsistencies in language use. the conclusion is somewhat abrupt and lacks a clear call to action. overall, the essay demonstrates a good effort, but could benefit from more development and refinement.",12.0
