author,school,year_written,title,type,text,score,score_out_of_100,grading_basic,score_basic_model,explanation_basic_model,loss_basic_model,grading_gemini,score_gemini,explanation_gemini,loss_gemini,grading_llama,score_llama,explanation_llama,loss_llama
Chirin Soh,Raffles Institution,2019,To what extent can the regulation of scientific or technological developments be justified.,gemma2,"To what extent can the regulation of scientific or technological developments be justified? This is a big question, right? Like, science is super cool and it can help us solve problems, but sometimes it can also be dangerous. 

We have to think about who makes the rules about science. Is it the scientists themselves? The government? Big companies? It's complicated!  Sometimes, people in charge just want to make money, not think about what's best for everyone. Like, remember that time those pharmaceutical companies were charging way too much for medicine? That's why we need rules to make sure science is used for good, not just profit.

Think about AI. It's getting smarter every day, which is awesome, but also kinda scary. What if AI robots take over the world? Or what if they make fake videos that trick people? We need to be careful! We need laws about AI before it gets out of control. 

And don't forget about things like genetically modified food.  Some people say it's great because it can grow more food, but others worry about the long-term effects. It's important to have rules about these things to make sure they are safe for us and the planet.


It's a tough balance, right? We want science to advance and help us, but we also need to protect ourselves from the bad stuff. Maybe the best way is to have lots of people talking about it – scientists, politicians, regular people like you and me.",25,50.0,"Score: 65/100

Explanation:

*   **Understanding and Application of Knowledge (18/30):** The essay demonstrates a basic understanding of the topic, identifying potential benefits and risks of scientific and technological advancements. It provides relevant examples like AI, genetically modified food, and pharmaceutical companies. However, the depth of understanding is limited, and the application of examples could be more sophisticated.
*   **Analysis and Evaluation (15/30):** The essay attempts to analyze the question by considering different perspectives (benefits vs. risks) and stakeholders (scientists, government, companies, public). However, the analysis is superficial and lacks critical evaluation of the arguments. The conclusion is weak and doesn't offer a well-supported stance.
*   **Clarity and Communication (22/30):** The essay is generally clear and easy to understand, but the language is informal and lacks the appropriate register for an academic essay. The vocabulary is limited, and the writing style is conversational rather than analytical.
*   **Structure and Organization (10/10):** The essay has a basic structure with an introduction, body paragraphs, and a conclusion. The ideas are presented in a logical order, and the paragraphs are reasonably well-linked.
",65.0,"Understanding and Application of Knowledge (18/30): The essay demonstrates a basic understanding of the topic, identifying potential benefits and risks of scientific and technological advancements. It provides relevant examples like AI, genetically modified food, and pharmaceutical companies. However, the depth of understanding is limited, and the application of examples could be more sophisticated.
Analysis and Evaluation (15/30): The essay attempts to analyze the question by considering different perspectives (benefits vs. risks) and stakeholders (scientists, government, companies, public). However, the analysis is superficial and lacks critical evaluation of the arguments. The conclusion is weak and doesn't offer a well-supported stance.
Clarity and Communication (22/30): The essay is generally clear and easy to understand, but the language is informal and lacks the appropriate register for an academic essay. The vocabulary is limited, and the writing style is conversational rather than analytical.
Structure and Organization (10/10): The essay has a basic structure with an introduction, body paragraphs, and a conclusion. The ideas are presented in a logical order, and the paragraphs are reasonably well-linked.",15.0,"Score: 45/100
Explanation: The essay demonstrates a basic understanding of the topic but lacks depth and critical analysis. The arguments are simplistic and lack specific examples or evidence. The writing style is informal and lacks the sophistication expected in an academic essay. The structure is rudimentary, with a weak introduction and conclusion.
- Understanding and Application of Knowledge: 15/30 - Shows some understanding of the topic but lacks depth and specific examples.
- Analysis and Evaluation: 10/30 - Limited analysis and evaluation of different perspectives.
- Clarity and Communication: 15/30 - The writing is clear but informal and lacks academic rigor.
- Structure and Organization: 5/10 - The structure is basic and lacks logical flow.
",45.0,"The essay demonstrates a basic understanding of the topic but lacks depth and critical analysis. The arguments are simplistic and lack specific examples or evidence. The writing style is informal and lacks the sophistication expected in an academic essay. The structure is rudimentary, with a weak introduction and conclusion.
- Understanding and Application of Knowledge: 15/30 - Shows some understanding of the topic but lacks depth and specific examples.
- Analysis and Evaluation: 10/30 - Limited analysis and evaluation of different perspectives.
- Clarity and Communication: 15/30 - The writing is clear but informal and lacks academic rigor.
- Structure and Organization: 5/10 - The structure is basic and lacks logical flow.",5.0,"score: 60
essay_id: to what extent can the regulation of scientific or technological developments be justified
explanation: this essay attempts to address the topic, but it lacks depth and clarity in its arguments. the writer raises some relevant points, such as the need for regulations to prevent the misuse of scientific advancements, the importance of considering multiple perspectives, and the potential risks associated with ai and genetically modified food. however, the essay lacks concrete examples, and the writer's ideas are not well-developed or supported by evidence. the writing is also informal and lacks cohesion, making it difficult to follow the writer's train of thought. overall, while the essay shows some understanding of the topic, it requires significant improvement in terms of organization, analysis, and communication.",60.0,"this essay attempts to address the topic, but it lacks depth and clarity in its arguments. the writer raises some relevant points, such as the need for regulations to prevent the misuse of scientific advancements, the importance of considering multiple perspectives, and the potential risks associated with ai and genetically modified food. however, the essay lacks concrete examples, and the writer's ideas are not well-developed or supported by evidence. the writing is also informal and lacks cohesion, making it difficult to follow the writer's train of thought. overall, while the essay shows some understanding of the topic, it requires significant improvement in terms of organization, analysis, and communication.",10.0
Ying,Raffles Institution,2020,"‘In this era of rapid Scientific development, religion is becoming obsolete.’ How far do you agree?",off_topic,"The rapid development of science has led many to believe that religion is becoming obsolete. However, I disagree with this statement. In fact, I believe that the true meaning of life lies not in the scientific explanations of the physical world, but in the pursuit of happiness and fulfillment.

In recent years, there has been a growing trend towards minimalism. Many people are starting to realize that material possessions do not bring true happiness. Instead, they are finding joy in the simple things in life, such as spending time with loved ones and pursuing their passions. This shift in mindset is a clear indication that people are searching for more than just scientific explanations.

Furthermore, the rise of social media has led to a sense of disconnection among people. Despite being more connected than ever before, many individuals feel lonely and isolated. This is because social media only provides a superficial connection, lacking the depth and intimacy of real-life relationships. As a result, people are beginning to crave meaningful interactions and a sense of community, which is often found in religious or spiritual practices.

In addition, the emphasis on standardized testing and academic achievement has led to a narrow focus on intellectual development. However, this has come at the cost of emotional intelligence and creativity. Many students are feeling burnt out and unfulfilled, despite achieving high grades. This is because they are not being encouraged to explore their passions and interests, but rather to simply memorize and regurgitate information.

In conclusion, the rapid development of science has not made religion obsolete. Instead, it has highlighted the need for a more holistic approach to life, one that values happiness, fulfillment, and meaningful connections.",18,36.0,"Score: 55/100

Explanation: The essay presents a viewpoint and attempts to support it, but the arguments are tangential to the core question of whether scientific development makes religion obsolete.

*   **Understanding and Application of Knowledge (12/30):** The essay demonstrates a basic understanding of the prompt but struggles to directly address the relationship between scientific development and religion's perceived obsolescence. The examples provided (minimalism, social media disconnection, emphasis on standardized testing) are weakly connected to the central argument. The student seems to be arguing for the importance of things *other* than science, rather than directly refuting the idea that science is making religion obsolete.

*   **Analysis and Evaluation (15/30):** The analysis is superficial. The essay identifies trends but doesn't critically evaluate how these trends relate to the perceived obsolescence of religion in light of scientific advancements. There's a lack of nuanced argumentation and consideration of counterarguments.

*   **Clarity and Communication (18/30):** The writing is generally clear and understandable. The vocabulary is adequate, and the language is mostly accurate. However, the overall coherence suffers from the weak connection between the arguments and the central thesis.

*   **Structure and Organization (10/10):** The essay follows a standard structure with an introduction, body paragraphs, and a conclusion. The paragraphs are logically organized, and there's a clear flow of ideas, even if the ideas themselves are not strongly connected to the prompt.
",55.0,"The essay presents a viewpoint and attempts to support it, but the arguments are tangential to the core question of whether scientific development makes religion obsolete.
Understanding and Application of Knowledge (12/30): The essay demonstrates a basic understanding of the prompt but struggles to directly address the relationship between scientific development and religion's perceived obsolescence. The examples provided (minimalism, social media disconnection, emphasis on standardized testing) are weakly connected to the central argument. The student seems to be arguing for the importance of things other than science, rather than directly refuting the idea that science is making religion obsolete.
Analysis and Evaluation (15/30): The analysis is superficial. The essay identifies trends but doesn't critically evaluate how these trends relate to the perceived obsolescence of religion in light of scientific advancements. There's a lack of nuanced argumentation and consideration of counterarguments.
Clarity and Communication (18/30): The writing is generally clear and understandable. The vocabulary is adequate, and the language is mostly accurate. However, the overall coherence suffers from the weak connection between the arguments and the central thesis.
Structure and Organization (10/10): The essay follows a standard structure with an introduction, body paragraphs, and a conclusion. The paragraphs are logically organized, and there's a clear flow of ideas, even if the ideas themselves are not strongly connected to the prompt.",19.0,"Score: 45/100
Explanation: The essay presents a stance against the obsolescence of religion despite scientific advancements, but it struggles with depth and direct relevance.

*   **Understanding and Application of Knowledge (12/30):** The essay touches on relevant themes like the search for meaning beyond materialism and the limitations of science in providing emotional fulfillment. However, it lacks a strong understanding of the core arguments surrounding the science vs. religion debate. The examples provided (minimalism, social media disconnection, standardized testing) are somewhat relevant but not directly tied to the central question of religion's obsolescence in light of scientific progress.
*   **Analysis and Evaluation (10/30):** The analysis is superficial. The essay identifies problems like social media disconnection and academic burnout but doesn't deeply analyze how these relate to the perceived need for religion or spirituality. There's a lack of critical evaluation of different perspectives. The conclusion is weak and doesn't synthesize the arguments effectively.
*   **Clarity and Communication (13/30):** The writing is relatively clear and uses appropriate language. However, the essay lacks a strong argumentative voice and doesn't present a compelling case. The vocabulary is limited, and the overall coherence could be improved.
*   **Structure and Organization (10/10):** The essay has a basic structure with an introduction, body paragraphs, and a conclusion. The paragraphs are logically sequenced, but the transitions between them could be smoother.
",45.0,"The essay presents a stance against the obsolescence of religion despite scientific advancements, but it struggles with depth and direct relevance.
Understanding and Application of Knowledge (12/30): The essay touches on relevant themes like the search for meaning beyond materialism and the limitations of science in providing emotional fulfillment. However, it lacks a strong understanding of the core arguments surrounding the science vs. religion debate. The examples provided (minimalism, social media disconnection, standardized testing) are somewhat relevant but not directly tied to the central question of religion's obsolescence in light of scientific progress.
Analysis and Evaluation (10/30): The analysis is superficial. The essay identifies problems like social media disconnection and academic burnout but doesn't deeply analyze how these relate to the perceived need for religion or spirituality. There's a lack of critical evaluation of different perspectives. The conclusion is weak and doesn't synthesize the arguments effectively.
Clarity and Communication (13/30): The writing is relatively clear and uses appropriate language. However, the essay lacks a strong argumentative voice and doesn't present a compelling case. The vocabulary is limited, and the overall coherence could be improved.
Structure and Organization (10/10): The essay has a basic structure with an introduction, body paragraphs, and a conclusion. The paragraphs are logically sequenced, but the transitions between them could be smoother.",9.0,"score: 82
essay_id: ‘in this era of rapid scientific development, religion is becoming obsolete.’ how far do you agree?
explanation: this essay demonstrates a good understanding of the topic and presents a clear argument. the writer provides relevant examples, such as the trend towards minimalism and the limitations of social media, to support their claim that religion is not becoming obsolete. the essay is well-organized and easy to follow, with a clear introduction, body, and conclusion. the writer's use of language is clear and concise, although there are some areas where the vocabulary could be more precise. the main area for improvement is in providing more nuanced and detailed analysis of the topic, as well as incorporating more explicit references to the keywords of the question.",82.0,"this essay demonstrates a good understanding of the topic and presents a clear argument. the writer provides relevant examples, such as the trend towards minimalism and the limitations of social media, to support their claim that religion is not becoming obsolete. the essay is well-organized and easy to follow, with a clear introduction, body, and conclusion. the writer's use of language is clear and concise, although there are some areas where the vocabulary could be more precise. the main area for improvement is in providing more nuanced and detailed analysis of the topic, as well as incorporating more explicit references to the keywords of the question.",46.0
J Wang,N.A.,2021,Art is only worth what people will pay for it. Do you agree?,llama,"The question wether art is only worth what people will pay for it, is a topic that has been debated by many art critics and lovers alike. In my opion, I strongly disagree with the statement. Art is worth much more than just its monetary value. The term ""starving artist"" is often used to describe an artist who is so dedicated to their craft that they dont care about the money. But when an artist becomes succesful and starts to earn alot of money, we call them a sellout and say that their art is no longer authentic. This is because we have become a society that values money above all else.

The value of art lies in its ability to bring about social change, to bring people together and to provide a platform for social commentary. For example, the Black Lives Matter movement has inspired many artists to create works that reflect the struggles of the black community. These artworks are not just worth the price that they are sold for, but they are also worth the impact that they have on society. The same can be said for films, music and literature. They are all forms of art that can bring about change and inspire people to take action.

On the other hand, some people may argue that art is only worth what people are willing to pay for it. They may say that if someone is willing to pay a million dollars for a painting, then that is what it is worth. But this is a very narrow-minded view of art. Art is not just about the price that it is sold for, it is about the impact that it has on people. It is about the emotions that it evokes and the conversations that it starts.

In conclusion, I believe that art is worth much more than just its monetary value. It is worth the impact that it has on society, the emotions that it evokes and the conversations that it starts. We should not just look at art as a commodity that can be bought and sold, but rather as a way to bring about change and to inspire people to take action.",32,64.0,"Score: 75/100
Explanation: The essay demonstrates a good understanding of the topic and presents a clear argument against the idea that art is only worth its monetary value. The student uses relevant examples like the Black Lives Matter movement to support their points. The essay is well-structured with a clear introduction, body paragraphs, and conclusion. However, the analysis could be deeper, exploring the complexities of art valuation more thoroughly. The language is generally accurate, but there are some minor grammatical errors and the vocabulary could be more sophisticated.
",75.0,"The essay demonstrates a good understanding of the topic and presents a clear argument against the idea that art is only worth its monetary value. The student uses relevant examples like the Black Lives Matter movement to support their points. The essay is well-structured with a clear introduction, body paragraphs, and conclusion. However, the analysis could be deeper, exploring the complexities of art valuation more thoroughly. The language is generally accurate, but there are some minor grammatical errors and the vocabulary could be more sophisticated.",11.0,"Score: 55/100
Explanation: The essay demonstrates a basic understanding of the topic and presents a clear stance. However, the analysis lacks depth and the examples are generic. The writing is clear but lacks sophistication, and the structure is simple but functional. The essay could be improved by providing more specific examples, developing the arguments further, and using more nuanced language.
",55.0,"The essay demonstrates a basic understanding of the topic and presents a clear stance. However, the analysis lacks depth and the examples are generic. The writing is clear but lacks sophistication, and the structure is simple but functional. The essay could be improved by providing more specific examples, developing the arguments further, and using more nuanced language.",9.0,"score: 85
essay_id: art is only worth what people will pay for it. do you agree?
explanation: this essay demonstrates a good understanding of the topic and presents a clear argument against the statement. the writer provides relevant examples, such as the black lives matter movement, to support their claim that art is worth more than its monetary value. the essay is well-structured and easy to follow, with a clear introduction, body, and conclusion. the writer's use of language is clear and concise, although there are some minor errors in grammar and spelling. the essay could be improved by providing more nuanced and detailed analysis of the topic, as well as more varied and sophisticated sentence structures. overall, this is a strong essay that demonstrates a good understanding of the topic and presents a clear and well-supported argument.",85.0,"this essay demonstrates a good understanding of the topic and presents a clear argument against the statement. the writer provides relevant examples, such as the black lives matter movement, to support their claim that art is worth more than its monetary value. the essay is well-structured and easy to follow, with a clear introduction, body, and conclusion. the writer's use of language is clear and concise, although there are some minor errors in grammar and spelling. the essay could be improved by providing more nuanced and detailed analysis of the topic, as well as more varied and sophisticated sentence structures. overall, this is a strong essay that demonstrates a good understanding of the topic and presents a clear and well-supported argument.",21.0
